end,end 2,end 3
Attender Service of Durgapur,,
Name,Address,Contact No
"Baba Loknath Attender Centre (Aaya, Child, Old, Patient)",Durgapur,09091388911/ 7098032939
"Sarada Aya Centre (Child, Old Patients & Attender)","6/7, Allaudin Khan Bithi, City Centre Durgapur, Durgapur- 713216",+91 9093574518/ 8609313390
Sayan Aaya Centre,"B-48, Meghamalla Sarani, Bidhannagar, Durgapur- 713212",08900632434/ 7384767016
"Seva Attender Centre (Child, Old, Patient)","6/7, Allaudin Khan Bithi, City Centre Durgapur, Durgapur- 713216",08900632434/ 7384767016
Uday Aya Centre,"Kittibas Road, B-Zone, Durgapur - 713205, Near B-Zone Maintenance Office",+91 8514873695